ticker,name,title,pub_date,link,description,score,target_stock,sentiment_score,sentiment_label,impact_intensity,time_horizon,news_type,key_drivers,trading_signal,reason
222080,씨아이에스,충북대 약학대학의 미래 100년을 향한 주춧돌 되길 …70주년 기념 유정...,2026-02-24 20:16,http://www.kyosu.net/news/articleView.html?idxno=158575,충북대학교(총장 직무대리 박유식)에 따르면 2월 24일(화) 오후 2시 유정희 ㈜드림씨아이에스 대표가 약학대학 70주년을 맞아 발전기금 1억 원을 기탁했다고 밝혔다. 이날 기탁식에는 기탁자인 유정희 ㈜드림씨아이에스... ,0.7,씨아이에스,0.3,Positive,Low,Short-term,Disclosure,"Philanthropy, Investment",Watch,"드림씨아이에스 대표의 기부 소식은 씨아이에스 주가에 단기적으로 소폭 긍정적 영향을 줄 수 있지만, 직접적인 사업 연관성은 낮음."
222080,씨아이에스,"의료AI 관련주, '으쓱으쓱 어깨춤' 모아데이타·젠큐릭스·셀바스헬스케...",2026-02-24 18:16,http://www.finomy.com/news/articleView.html?idxno=250206,"하지만 쓰리빌리언, 노을, 루닛, 토마토시스템, 이지케어텍, 뷰노, 드림씨아이에스, 씨어스테크놀로지... 드림씨아이에스는 2000년 설립된 임상시험수탁기관으로, 2015년 중국 TOP CRO 타이거메드가 지분을 인수했다.... ",0.7,씨아이에스,0.0,Neutral,Low,Short-term,Fact,의료AI,Watch,"씨아이에스와 직접적인 연관성은 낮으나, 의료AI 테마 전반에 대한 관심도를 고려하여 관망."
218410,RFHIC,“목표주가 37만→49만 원”…SK 순매수 1위 [주식 초고수는 지금],2026-02-23 11:52,https://n.news.naver.com/mnews/article/011/0004592411?sid=101,"전일 순매수 상위 종목은 삼성전자(005930), SK텔레콤, RFHIC(218410)였고 순매도 상위 종목에는 삼성SDI(006400), SK이노베이션, 셀트리온(068270) 등이 이름을 올렸다. 미래에셋증권은 자사 고객 중에서 지난 1개월간 수익률... ",0.85,RFHIC,0.3,Slightly Positive,Medium,Short-term,Expectation,"5G, 네트워크 장비",Watch,"목표주가 상향은 긍정적이지만, SK텔레콤 순매수 상위 종목에 포함된 정보 외 구체적인 내용이 부족하여 관망 필요."
218410,RFHIC,코스닥 '상승'...현대무벡스 · 휴림로봇 · 현대바이오 '껑충',2026-02-24 16:48,http://www.choicenews.co.kr/news/articleView.html?idxno=161467,"통신장비주 중 오이솔루션(-1.12%), RFHIC(-2.20%), 케이엠더블유(-3.49%) 등이 하락했다. 코스닥 시총 상위주 중 리브스메드가 5.20% 급등했고 클래시스(-2.03%), 유진테크(-1.41%) 등은 내렸다. 코스닥 지수는... ",0.7,RFHIC,-0.3,Negative,Medium,Short-term,Fact,통신장비,Sell,RFHIC 주가 하락으로 단기적으로 부정적 영향을 줄 수 있음
218410,RFHIC,"중국 반도체 시장 잡는다…기가레인, 우시 신공장 가동으로 실적 반등 ...",2026-02-24 15:54,https://www.pinpointnews.co.kr/news/articleView.html?idxno=431834,"질화갈륨(GaN) 트랜지스터 강자 RFHIC와 광통신 소자의 빛과전자, 네트워크 구축 전문 오파스넷도 내림세를 기록했다. 기간 통신사인 KT는 2.95% 하락 마감했다. 특히 안테나 및 필터 전문 케이엠더블유와 화합물 반도체... ",0.7,RFHIC,0.0,Neutral,Low,Short-term,Fact,GaN,Watch,기사 내용이 RFHIC에 직접적인 영향을 미치는 내용이 미미함
006340,대원전선,[오늘의 코스피 · 2월 24일] 금일 상승주 TOP 10…1위 에이프로젠,2026-02-24 21:16,http://www.newsbrite.net/news/articleView.html?idxno=196582,▲상위 종목 지표(출처: 한국거래소) ©뉴스브라이트 순위 종목명 현재가 전일비 등락률 거래량 PER ROE ▲상위 종목 지표(출처: 한국거래소) ©뉴스브라이트 대원전선(006340)은 등락률 +19.67%로 6... ,0.7,대원전선,0.7,Positive,Medium,Short-term,Fact,"상승, 거래량",Watch,"대원전선이 코스피 상승률 상위 종목에 랭크되어 단기적으로 긍정적인 영향을 줄 수 있지만, 지속적인 상승 여부는 지켜봐야 함."
006340,대원전선,"[공시속보] 대원전선, 투자주의종목 예고→투자경고 가능성 부각",2026-02-24 20:24,https://www.topstarnews.net/news/articleView.html?idxno=15983530,한국거래소에 따르면 대원전선(006340)이 2026년 2월 25일자로 투자주의종목으로 지정될 예정이라고 밝혔다. 이번 지정예고는 대원전선의 2026년 2월 24일 종가가 5일 전일 종가 대비 60% 이상 상승했기 때문인 것으로... ,0.7,대원전선,-0.3,약간 부정적,Medium,Short-term,Disclosure,"투자주의, 단기 급등",Watch,투자주의 종목 지정 예고로 단기적인 변동성 확대 가능성이 있으므로 관망 필요.
006340,대원전선,"전선조합, 13개 대·중견기업 단계적 탈퇴… '중소기업 중심' 재편",2026-02-24 17:18,https://www.electimes.com/news/articleView.html?idxno=365447,"총회 결의에 따라 전선조합은 조합원 재편을 위한 13개사의 단계적 탈퇴를 추진키로 하고, 1차로 대한전선, LS전선, 가온전선, 대원전선, 일진전기, 지엔피, 극동전선 등 7개사를 2026년 12월 말까지 탈퇴 처리키로 했다.... ",0.7,대원전선,-0.3,Slightly Negative,Medium,Mid-term,Fact,"전선산업 재편, 조합 탈퇴",Watch,"대원전선의 전선조합 탈퇴는 중립적인 이벤트이나, 산업 재편에 따른 영향을 주시할 필요가 있음"
042700,한미반도체,HBM4 생산속도 좌우할 TC본더…삼성·SK하닉 '이로동귀' 눈길,2026-02-24 20:40,https://www.ajunews.com/view/20260224153008837,"SK하이닉스는 기존 한미반도체 일변도에서 벗어나 한화세미텍, ASMPT로 다변화 전략을 펼치고 있다. 실제로 HBM4 도입을 앞두고 한미반도체 외에도 한화세미텍에 장비를 주문했으며, 올해 초에도 두 공급사로부터... ",0.7,한미반도체,-0.3,약간 부정적,Medium,Short-term,Fact,"HBM, TC본더, 반도체 장비 다변화",Watch,SK하이닉스의 TC본더 공급망 다변화 시도가 한미반도체에 단기적으로 부정적 영향을 줄 수 있음
042700,한미반도체,"[공매도 브리핑] 2월 24일 거래대금 1조 6,863억…미래에셋증권·에코프...",2026-02-24 19:08,https://www.topstarnews.net/news/articleView.html?idxno=15983458,"T-2 기준 공매도 잔고금액 상위 종목은 코스피에서 LG에너지솔루션 1조 3,216억 원, 현대차 1조 1,775억 원, 한미반도체 1조 606억 원, 미래에셋증권 8,546억 원, 포스코퓨처엠 7,008억 원이었다. 코스닥은 에코프로 9... ",0.7,한미반도체,-0.3,Negative,Medium,Short-term,Fact,공매도,Watch,한미반도체의 공매도 잔고가 높은 수준으로 단기적인 주가 하락 압력으로 작용할 수 있음
010820,퍼스텍,"美, 이란 압박에…한화에어로 급등",2026-02-22 17:43,https://n.news.naver.com/mnews/article/015/0005253459?sid=101,"그 외 한화시스템(9.49%), LIG넥스원(5.08%), 현대로템(4.76%), 한국항공우주(1.43%) 등 대형주는 물론 퍼스텍(26.08%), 솔디펜스(11.82%), 빅텍(11.21%) 등 코스닥시장 상장 중소형 방산주까지 일제히 상승했다. 이달 들어 부진하던... ",0.9,퍼스텍,0.6,Positive,Medium,Short-term,Fact,"방산, 이란",Watch,미국-이란 긴장 고조로 인한 방산주 전반적인 상승 모멘텀 발생
010820,퍼스텍,"""열흘 안에 결판"" 트럼프 한마디에…주가 들썩이는 종목 [종목+]",2026-02-20 22:01,https://n.news.naver.com/mnews/article/015/0005253193?sid=101,"그 외 한화시스템(9.49%), LIG넥스원(5.08%), 현대로템(4.76%), 한국항공우주(1.43%) 등 대형주는 물론 퍼스텍(26.08%), 솔디펜스(11.82%), 빅텍(11.21%) 등 코스닥에 상장된 중소형 방산주도 일제히 상승했다. 이달 들어 방산주는... ",0.9,퍼스텍,0.3,Positive,Medium,Short-term,Rumor,"방산, 트럼프",Watch,트럼프 관련 발언에 따른 단기적인 주가 변동성 증가 예상
010820,퍼스텍,"매커스, '자사주 소각+AI 수혜' 쌍끌이…주가 본격 우상향 신호탄",2026-02-24 16:04,https://www.pinpointnews.co.kr/news/articleView.html?idxno=431848,"냉각 시스템 및 엔진 부품 전문 인지컨트롤스와 유도무기 구동장치의 퍼스텍, 차량용 카메라 및 드론 영상 인식 기술을 보유한 엠씨넥스가 수익권을 형성했다. 방산 대장주인 한화에어로스페이스와 국내 최대 항공사인... ",0.7,퍼스텍,0.0,Neutral,Low,Short-term,Fact,방산,Watch,"퍼스텍 관련 내용이 기사에서 비중이 적고, 긍정적/부정적 방향성을 판단하기 어려움"
089470,HDC현대EP,HDC현대EP 신우철 대표 선임,2026-02-24 13:10,https://www.naeil.com/news/read/578934?ref=naver,HDC그룹은 신우철(사진) HDC현대EP 대표이사를 선임했다고 24일 밝혔다. 신 대표는 3월 16일자로 대표이사직에 오른다. 신 신임 대표는 삼성제일모직 케미칼사업부를 시작으로 약 30년간 삼성과 롯데그룹 화학·소재... ,0.7,HDC현대EP,0.1,Slightly Positive,Low,Short-term,Disclosure,"경영진 변경, 신규 대표 선임",Watch,"대표이사 변경은 단기적으로 큰 영향을 미치지 않을 수 있으나, 향후 경영 전략 변화 가능성을 주시해야 함."
089470,HDC현대EP,2월 23일 주식시장 주요공시,2026-02-24 08:49,https://www.catchnews.kr/news/articleView.html?idxno=120917,"▶제이피아이헬스케어(0010V0) - 2025년4분기 연결기준 매출액 122.89억원(전년동기대비 -3.57%), 영업이익 14.28억원(전년동기대비 -21.88%), 순이익 16.99억원(전년동기대비 -34.45%) ▶HDC현대EP, 보통주 1주당... ",0.7,HDC현대EP,0.0,Neutral,Low,Short-term,Disclosure,,Ignore,주요 공시 사항에 HDC현대EP에 대한 구체적인 내용이 없어 중립적 영향으로 판단.
089470,HDC현대EP,"HDC그룹, 신우철 신임 HDC현대EP 대표 선임",2026-02-24 07:58,http://www.ttlnews.com/news/articleView.html?idxno=3082364,HDC그룹은 3월 16일부로 신우철을 HDC현대EP 대표이사로 선임한다. 신우철 대표이사는 삼성제일모직 케미칼사업부에서 시작해 약 30년간 삼성과 롯데그룹의 화학·소재 계열사에서 경력을 쌓은 글로벌 첨단 소재... ,0.7,HDC현대EP,0.2,Neutral,Low,Short-term,Disclosure,"경영진 변경, 첨단소재",Watch,"경영진 교체는 단기적으로 주가에 큰 영향을 주지 않을 수 있지만, 장기적으로 기업 전략 변화를 가져올 수 있어 관찰 필요."
010780,아이에스동서,원전 수주·업황개선 기대 중소형 건설주까지 '온기',2026-02-23 17:50,https://n.news.naver.com/mnews/article/009/0005640769?sid=101,올해 실적 턴어라운드 기대감 연초 이후 건설주 주가 강세 이달 아이에스동서 38% 올라 업황 반등 기대감과 원전 수주 모멘텀에 힘입어 건설주 주가가 강세를 이어가고 있다. 23일 한국거래소에 따르면 이날 현대건설... ,0.9,아이에스동서,0.6,Positive,Medium,Short-term,Expectation,"원전수주, 건설업황개선",Watch,"원전 수주 기대감과 건설 업황 개선 기대감으로 주가 상승 모멘텀이 예상되나, 단기적인 관점에서 신중한 접근이 필요함"
010780,아이에스동서,"건설업, 국내외 원전·주택 수요 기대…""GS건설·삼성물산·아이에스동...",2026-02-24 17:36,http://www.biztribune.co.kr/news/articleView.html?idxno=349351,"변동성이 클 것으로 전망된다""고 말하며, ""건설업에서 중요한 이벤트는 주택 지표와 해외 수주, 해외 원전 뉴스""라고 강조했다. 주간 추천 종목으로는 ""GS건설, 삼성물산, 아이에스동서를 제시한다""고 밝혔다. [비즈트리뷴=]",0.7,아이에스동서,0.6,Positive,Medium,Mid-term,Expectation,"원전, 주택",Buy,국내외 원전 및 주택 수요 증가 기대감으로 추천 종목에 포함됨
010780,아이에스동서,[상대강도과열 종목] SKAI·비츠로시스 '앗~뜨거' …단기 과열 신호 확산,2026-02-24 16:42,https://www.pinpointnews.co.kr/news/articleView.html?idxno=431889,"옴니시스템, 아이에스동서, TBH글로벌, 코리안리, 코데즈컴바인, 금호건설, 삼성E&A, WISCOM, 대원전선우, 삼성전기우, 대성하이텍, 포인트엔지니어링, 남양유업우, 엔에프씨, 옵티팜, TIGER S&P글로벌인프라(합성)... ",0.7,아이에스동서,-0.3,Negative,Low,Short-term,Rumor,과열,Watch,상대강도 과열 종목으로 분류되어 단기 과열 신호 확산 가능성이 있으므로 주의가 필요함
452260,한화갤러리아,"한화갤러리아, 지난해 흑자 전환... 영업익 177% 껑충",2026-02-24 23:54,http://www.metroseoul.co.kr/article/20260224500665,한화갤러리아가 명품 수요 회복과 외국인 관광객 유입에 힘입어 지난해 뚜렷한 실적 개선을 이뤄내며 흑자 전환에 성공했다. 한화갤러리아는 지난해 연결 기준 영업이익이 94억원으로 전년 대비 177.7% 증가했다고 24일... ,0.7,한화갤러리아,0.7,Positive,Medium,Short-term,Earnings,"명품, 외국인 관광객, 실적 개선",Buy,흑자 전환 및 영업이익 증가로 단기적인 주가 상승 가능성이 있음
036540,SFA반도체,"글로벌 자동차사도 러브콜... KEC, 전장용 반도체 비중 확대로 제2의 도...",2026-02-24 18:42,https://www.pinpointnews.co.kr/news/articleView.html?idxno=431925,"기판 전문 티엘비와 지주사 원익홀딩스, 후공정 장비 강자 한미반도체, 설계 지원의 엠디바이스, 패키징 전문 네패스, 가스 정화 장치의 GST, 패키징 전문 SFA반도체, 유통 전문 유니퀘스트, 소재 전문 덕산테코피아도... ",0.7,SFA반도체,0.1,Slightly Positive,Low,Mid-term,Fact,"반도체 패키징, 전장용 반도체",Watch,"SFA반도체가 전장용 반도체 시장의 간접적인 수혜를 받을 수 있으나, 직접적인 연관성은 낮아 관망 필요."
036540,SFA반도체,"SFA반도체 주가, 24일 장중 7,400원 3.93% 상승",2026-02-24 14:42,https://www.e-science.co.kr/news/articleView.html?idxno=126802,"| 이코노미사이언스 정상훈 기자 | 24일 오후 1시 44분 기준, 네이버페이 증권에 따르면 SFA반도체 주가는 지난 종가 대비 상승세를 보이며 7,400원에 거래되고 있다. 이는 지난 종가 7,120원보다 280원 상승한... ",0.7,SFA반도체,0.3,Positive,Low,Short-term,Fact,반도체,Watch,주가 소폭 상승에 대한 단순 보도이므로 단기적 영향은 미미할 것으로 예상.
036540,SFA반도체,"시스템반도체 관련주, '함박웃음' 엠디바이스·아이에이·윈팩... '한숨푹...",2026-02-24 00:16,http://www.finomy.com/news/articleView.html?idxno=250141,"반면 SFA반도체, 고영, 하나마이크론, 이미지스는 하락했다. SFA반도체와 고영은 전 거래일 대비 각각 190원, 850원 내린 7120원과 3만1050원에 거래됐다. SFA반도체와 고영의 주가 하락률은 각각 2.60%, 2.66%다.... ",0.7,SFA반도체,-0.3,Negative,Medium,Short-term,Fact,시스템반도체,Watch,SFA반도체의 주가 하락 소식이 단기적으로 부정적인 영향을 줄 수 있음
024060,흥구석유,[MK시그널] 이란戰 가능성에 흥구석유 '쑥',2026-02-24 17:19,https://n.news.naver.com/mnews/article/009/0005641304?sid=101,"지난 19~23일 MK시그널이 차익을 실현한 종목 가운데 가장 높은 수익률을 낸 종목은 흥구석유다. MK시그널은 흥구석유를 지난 23일 매수한 뒤 같은 날 매도했으며, 23.85% 수익률을 기록했다. 흥구석유는 GS칼텍스로부터... ",0.9,흥구석유,0.3,Positive,Medium,Short-term,Fact,"이란 전쟁 가능성, GS칼텍스",Watch,"이란 전쟁 가능성에 따른 단기적인 주가 상승 가능성이 있지만, 지정학적 리스크에 따른 변동성 확대에 주의 필요."
024060,흥구석유,유가 뛰자 정유주 동반 랠리,2026-02-22 17:53,https://n.news.naver.com/mnews/article/011/0004592162?sid=101,20일 SK이노베이션의 주가는 7.59% 올랐고 흥구석유 주가는 하루 사이 24.36% 급등했다. 정유 관련 상장지수펀드(ETF)도 일제히 강세를 이어가고 있다. KODEX 에너지화학 ETF는 20일 1.72% 상승한 1만 6575원에 마감했다.... ,0.85,흥구석유,0.7,Positive,High,Short-term,Fact,"유가 상승, 정유주 강세",Watch,유가 상승에 따른 정유주 전반의 급등으로 단기적인 주가 변동성 확대 예상
024060,흥구석유,[서울데이터랩]금일 코스닥 거래량 1위 우리기술 거래대금 무려 4935억 돌...,2026-02-24 13:32,https://n.news.naver.com/mnews/article/081/0003620342?sid=101,"대한광통신(010170)은 5.0% 하락하며 4510원을 기록했고, 흥구석유(024060)는 1.4% 상승하며 2만 2150원에 거래되고 있다. SKAI(357880)도 24.1% 상승하며 2755원으로 거래 중이다. 한편 거래량 상위 20위권 종목들은... ",0.7,흥구석유,0.1,Slightly Positive,Low,Short-term,Fact,"거래량, 주가 상승",Watch,"흥구석유 주가가 소폭 상승했지만, 거래량 증가 외 뚜렷한 호재는 없어 관망 필요."
196450,코아시아씨엠,"[공시속보] 코아시아씨엠, 투자주의종목 지정예고→급등세 이어 투자자...",2026-02-24 20:28,https://www.topstarnews.net/news/articleView.html?idxno=15983546,"코아시아씨엠(196450)이 2026년 2월 25일 하루 동안 투자주의종목으로 지정된다고 한국거래소에 따르면 밝혔다. 회사는 최근 15일간 주가가 82.23% 상승하며 당일 상위 20개 계좌의 매수관여율이 47.40%에 달했고, 상위 3개... ",0.7,코아시아씨엠,-0.3,약간 부정적,Medium,Short-term,Disclosure,"투자주의종목 지정, 투기적 거래",Watch,투자주의종목 지정 예고로 단기적 변동성 확대 가능성 존재
196450,코아시아씨엠,[상대강도과열 종목] SKAI·비츠로시스 '앗~뜨거' …단기 과열 신호 확산,2026-02-24 16:42,https://www.pinpointnews.co.kr/news/articleView.html?idxno=431889,"이외에도 코아시아씨엠, 지투파워, 코오롱글로벌, 제일연마, 삼성전기, 대한조선, SV인베스트먼트, 디티앤씨알오, 서울식품, 우원개발, KODEX 건설, 성창기업지주, 키움 레버리지 전력 TOP5 ETN, CJ프레시웨이, 서한... ",0.7,코아시아씨엠,0.0,Neutral,Low,Short-term,Rumor,"과열, 단기 과열",Watch,상대강도 과열 종목에 포함되어 단기 과열 신호 발생 가능성이 있으므로 관망 필요.
196450,코아시아씨엠,"[52주] 최고가 73개, 최저가 26개...지수 혼조세",2026-02-24 09:58,https://www.itooza.com/common/iview.php?no=2026022409340107853,"8% 19,800 ★ 16 코아시아씨엠 1,540 ▲8.7% 1,540 ★★★ 17 딜리 1,003 ▲8.6% 1,168 ★★★★ 18 매커스 31,050 ▲8.2% 32,150 ★★★★ 19 모아텍 4,715 ▲8.1% 5,010 ★★★ 20 이지홀딩스 8,340 ▲8.0... ",0.7,코아시아씨엠,0.3,Positive,Medium,Short-term,Fact,반도체,Watch,주가 상승폭이 크지 않아 단기적인 관점에서 지켜볼 필요가 있음
095610,테스,AI·바이오 특허 심사 ‘1개월’ 시대 열렸다,2026-02-24 08:01,https://n.news.naver.com/mnews/article/011/0004592720?sid=101,가우스랩스는 모회사 SK하이닉스(000660)와 공동으로 AI 기반 가상 계측 솔루션 ‘파놉테스 VM’의 실제 공정 적용 사례를 담은 논문 2편을 발표한다. SK하이닉스 부사장과 글로벌파운드리 수석부사장이 기조연설자로... ,0.85,테스,0.3,Slightly Positive,Medium,Mid-term,Fact,"AI, 반도체, SK하이닉스",Watch,AI 기반 솔루션 적용 확대로 인한 반도체 공정 효율성 개선 기대
095610,테스,“대기업 월급 중소기업의 2배”… 성별 격차도 1.5배,2026-02-24 08:01,https://n.news.naver.com/mnews/article/011/0004592722?sid=101,또한 가우스랩스는 모회사 SK하이닉스(000660)와 함께 AI 기반 가상 계측 솔루션 ‘파니테스 VM’의 실제 공정 적용 사례를 발표할 예정이다. 제원호 멀티스케일인스트루먼트 대표는 “계측 검사는 반도체 수율을... ,0.85,테스,0.2,Slightly Positive,Medium,Short-term,Fact,"AI, 반도체 수율, SK하이닉스",Watch,"SK하이닉스와의 AI 기반 솔루션 협력 발표는 긍정적이지만, 제목의 임금 격차 관련 내용은 중립적인 영향을 미칠 수 있음"
095610,테스,"엔비디아, AI 서버 넘어 노트북 시장 공략…SoC ‘N1’ 출시 준비",2026-02-24 08:00,https://n.news.naver.com/mnews/article/011/0004592718?sid=101,가우스랩스는 SK하이닉스(000660)와 함께 AI 기반 가상 계측 솔루션 ‘파놉테스 VM’의 실제 공정 적용 논문 2편을 발표한다. 반도체 수율을 좌우하는 계측 분야에서 한국 스타트업들이 글로벌 경쟁력을 입증하는... ,0.85,테스,0.2,약간 긍정,Medium,Mid-term,Expectation,"AI, 반도체, 엔비디아, 수율, 가상 계측",Watch,엔비디아의 AI 노트북 시장 진출이 반도체 수율 관련 기업에 미치는 잠재적 영향에 대한 관찰 필요
221800,유투바이오,키움운용 ETF 4종 내달 상장폐지..신탁원본액 감소,2026-02-24 18:06,http://www.4th.kr/news/articleView.html?idxno=2107980,"'KIWOOM Fn유전자혁신기술'은 'FnGuide 유전자혁신기술 지수'를 1배 추종하는 ETF로, △유투바이오 △제이에스링크 △셀비온 △보로노이 △EDGC △에스바이오메딕스 △메디포스트 △에스티팜 △이엔셀... ",0.7,유투바이오,-0.3,약간 부정적,Medium,Short-term,Disclosure,"ETF 상장폐지, 유전자혁신기술",Watch,ETF 상장폐지로 인한 유투바이오 투자 심리 위축 가능성 존재
221800,유투바이오,"유투바이오 주가 11% 털썩…장중 약세로 전환, 최근 흐름은?",2026-02-24 14:58,https://www.cbci.co.kr/news/articleView.html?idxno=557391,유투바이오(221800) 주가가 24일 장에서 급락세를 보이고 있다. 유투바이오는 24일 오후 2시 52분 현재 21850원에 거래되고 있다. 전일 종가보다 11.71% 내렸다. 유투바이오는 앞서 지난 9일부터 23일까지 그야말로... ,0.7,유투바이오,-0.6,Negative,Medium,Short-term,Fact,,Sell,주가 급락으로 인한 단기적 매도세 예상
221800,유투바이오,"메디케어, '모발이식 컨설팅' 날개 달고 수익성 개선 가속페달",2026-02-24 13:22,https://www.pinpointnews.co.kr/news/articleView.html?idxno=431760,"파미셀은 4.83% 하락하며 조정을 받고 있으며, 유투바이오는 15.96% 급락하며 테마 내 종목 중 가장 저조한 흐름을 보였다. 이는 단기 급등에 따른 피로감과 개별 기업의 실적 발표를 앞둔 경계감이 작용한 결과로 보인다.",0.7,유투바이오,-0.7,Negative,Medium,Short-term,Fact,"실적 발표, 단기 급등 피로감",Sell,"유투바이오 주가 급락은 단기 급등에 따른 피로감과 실적 발표 경계감 때문으로, 매도 신호로 판단됨."
100790,미래에셋벤처투자,'1500억 실탄' 지투지바이오…2공장 기반 글로벌 파트너십 박차,2026-02-24 15:49,https://n.news.naver.com/mnews/article/008/0005321580?sid=101,"KB증권과 미래에셋벤처투자, LS증권, NH투자증권, 데일리파트너스 등 주요 기관투자자가 참여했으며 의무보유 기간은 1년이다. 연초 500억원 미만의 현금을 보유하고 있던 지투지바이오는 이번 자금조달을 통해 유동성을... ",0.85,미래에셋벤처투자,0.0,Neutral,Low,Short-term,Fact,"자금 조달, 투자 유치",Watch,"미래에셋벤처투자가 참여한 투자 건으로, 해당 기업 자체에 직접적인 영향은 제한적이라고 판단됨."
100790,미래에셋벤처투자,출항 앞둔 '한국형 BDC'… 불장 속 '개미 마음' 흥행 변수,2026-02-24 04:08,https://n.news.naver.com/mnews/article/008/0005321162?sid=101,"한 증권사 관계자는 ""미래에셋벤처투자, DSC인베스트먼트 등 이미 상장된 VC만 10곳이 넘는다""며 ""지분투자라는 점에서는 비상장기업에 투자하는 상장 VC에 투자하는 것이 BDC 투자와 큰 차이가 없다고 본다""고 말했다.... ",0.85,미래에셋벤처투자,0.0,Neutral,Medium,Short-term,Expectation,"BDC, 벤처투자",Watch,"BDC 출시에 대한 기대감이 있지만, 이미 상장된 VC와의 차별성이 불분명하여 중립적 관점 유지."
100790,미래에셋벤처투자,"피지컬AI 유망주 ‘리얼월드’, 美 본사 이전 선택한 배경은 [빛이 나는...",2026-02-21 12:01,https://n.news.naver.com/mnews/article/011/0004591954?sid=101,"투자자 구성도 SK텔레콤(017670), LG전자(066570), 미래에셋벤처투자(100790) 등 국내 기업들이 주요 주주로 참여하고 있으며, 현재 협력 관계를 맺고 있는 파트너사들 또한 한국을 비롯한 일본 기업이 대다수를 차지한다.... ",0.85,미래에셋벤처투자,0.3,약간 긍정,Medium,Mid-term,Fact,"AI, 벤처투자, 해외 확장",Watch,"피지컬 AI 기업의 미국 본사 이전이 미래에셋벤처투자에 미치는 영향은 중립적이며, 성장 가능성을 지켜볼 필요가 있음"
