ticker,name,title,pub_date,link,description,score,target_stock,sentiment_score,sentiment_label,impact_intensity,time_horizon,news_type,key_drivers,trading_signal,reason
319660,피에스케이,“트럼프 관세 무색” 반도체 투톱 새 역사...소부장 ‘잭팟’,2026-02-24 16:57,https://n.news.naver.com/mnews/article/050/0000102786?sid=101,"이 밖에도 한미반도체(2.94%)를 비롯해 브이렘(19.34%), 피에스케이(12.74%), 해성디에스(12.16%)등 관련 기업들이 두 자릿수 수익률을 기록하며 강세를 보였다. 삼성전자와 SK하이닉스가 주요 고객사들과 장기 계약을 통해... ",0.9,피에스케이,0.6,Positive,Medium,Short-term,Fact,"반도체, 소부장",Watch,"피에스케이 주가 상승 및 반도체 소부장 관련 기업 강세로 긍정적이지만, 단기적 영향으로 판단됨"
319660,피에스케이,"20만전자·100만닉스 끌고, 소부장 밀고…반도체주 '강세'(종합)",2026-02-24 16:26,https://n.news.naver.com/mnews/article/421/0008790759?sid=101,"이외에도 반도체 소재·부품·장비 기업인 브이엠(089970)(19.34%), 피에스케이(319660)(12.74%), 해성디에스(195870)(12.16%), 씨엠티엑스(388210)(10.34%), 예스티(122640)(10.16%) 등이 두 자릿수대 강세를 보였다. 삼성전자... ",0.8,피에스케이,0.6,Positive,Medium,Short-term,Fact,"반도체, 소부장",Watch,피에스케이가 반도체 소부장 강세 속에서 두 자릿수 상승률을 기록하여 단기적인 관심이 필요함
319660,피에스케이,"글로벌 자동차사도 러브콜... KEC, 전장용 반도체 비중 확대로 제2의 도...",2026-02-24 18:42,https://www.pinpointnews.co.kr/news/articleView.html?idxno=431925,"식각 장비 전문 브이엠과 세정 장비 강자 피에스케이는 각각 10~19%대의 높은 수익률을 기록했다. 반도체... 인쇄회로기판 전문 타이거일렉, 진공 밸브 전문 제이엔비, 세정 장비의 제우스, 패키징 설비의 피에스케이홀딩... ",0.7,피에스케이,0.0,Neutral,Low,Short-term,Fact,반도체 장비,Watch,"피에스케이가 언급되었으나, 긍정적/부정적 영향을 판단하기 어려운 정보가 포함되어 있음."
327260,RF머트리얼즈,"글로벌 1위와 손잡았다…아모센스, SOFC 기판 국산화 '청신호'",2026-02-24 09:22,https://www.pinpointnews.co.kr/news/articleView.html?idxno=431661,"현재 무선충전 차폐시트와 자동차 전장 및 RF 모듈, IoT 디바이스를 주력 매출원으로 삼고 안정적인 수익... LS머트리얼즈도 1.73% 상승하며 힘을 보태고 있다. 연료전지 시장의 전통 강자들도 견조한 흐름을 유지한다.... ",0.7,RF머트리얼즈,0.3,약간 긍정,Medium,Mid-term,Fact,"SOFC, 연료전지",Watch,SOFC 기판 국산화 청신호는 긍정적이나 RF머트리얼즈와의 직접적인 연관성은 낮아 관망 필요.
327260,RF머트리얼즈,"[52주] 최고가 172개, 최저가 39개...코스피 5900 돌파",2026-02-23 09:50,https://www.itooza.com/common/iview.php?no=2026022309340108986,"7% 197,600 ★★★★★ 94 RF머트리얼즈 46,100 ▲2.4% 47,750 ★★★ 95 동우팜투테이블 2,430 ▲2.3% 2,475 ★★★★ 96 원일특강 9,750 ▲2.2% 9,750 ★★ 97 엘앤씨바이오 120,900 ▲2.2% 125... ",0.7,RF머트리얼즈,0.0,Neutral,Low,Short-term,Fact,,Ignore,52주 최고가/최저가 언급 기사이며 RF머트리얼즈에 대한 직접적인 투자 판단 근거는 부족함
327260,RF머트리얼즈,"5G 넘어 6G로... RF머트리얼즈, 차세대 화합물 반도체 열풍에 주가 폭등",2026-02-23 06:12,https://www.pinpointnews.co.kr/news/articleView.html?idxno=431178,한국거래소에 따르면 이날 시장에서 가장 돋보인 종목은 화합물 반도체용 패키지 전문 기업인 RF머트리얼즈였다. 전일 대비 16.88% 폭등한 4만 5000원에 장을 마감하며 테마 대장주 역할을 톡톡히 했다. 국내 질화갈륨... ,0.7,RF머트리얼즈,0.7,Positive,Medium,Short-term,Fact,"6G, 화합물 반도체, 질화갈륨",Watch,6G 테마 부상에 따른 주가 급등으로 단기적 관점에서 지켜볼 필요가 있음
171090,선익시스템,"[기업공시] 미래에셋증권, 에코프로비엠, KT&G, 키다리스튜디오 외",2026-02-24 23:02,https://www.kdpress.co.kr/news/articleView.html?idxno=202894,처분임 ■ 선익시스템 (171090) CB 전환청구 주식 12만주 상장 예정일 변경 정정사유 : 등기 지연에 따른 상장 예정일 정정 2026-02-11 청구분 : 상장예정일 2026-03-06 (정정 전 03-04) 2026-02-19 청구분 : 상장예정일... ,0.7,선익시스템,0.0,Neutral,Low,Long-term,Disclosure,CB 전환,Watch,"선익시스템 CB 전환 청구 주식 상장 예정일 변경에 대한 공시로, 주가에 미치는 영향은 미미할 것으로 예상됨"
171090,선익시스템,"[공시속보] 선익시스템, 소수계좌 매수과다로 투자주의종목 지정→투자...",2026-02-24 20:26,https://www.topstarnews.net/news/articleView.html?idxno=15983544,한국거래소에 따르면 선익시스템(171090)은 최근 15일간 주가상승률이 111.56%에 달해 투자자들의 주목을 받고 있다. 해당 종목은 2026년 2월 25일 1일간 투자주의종목으로 지정돼 투자자들의 각별한 주의가 필요하다고... ,0.7,선익시스템,-0.3,Negative,Medium,Short-term,Disclosure,,Watch,소수계좌 매수 과다로 투자주의 종목 지정되어 단기적 주의 필요.
077360,덕산하이메탈,"글로벌 자동차사도 러브콜... KEC, 전장용 반도체 비중 확대로 제2의 도...",2026-02-24 18:42,https://www.pinpointnews.co.kr/news/articleView.html?idxno=431925,"중고 장비 유통 및 개조 전문 러셀과 IP 설계 전문 퀄리타스반도체, 반도체 진공 라인 부품사 엔투텍, 테스트 인터페이스 전문 티에스이, 소재 전문 엘케이켐과 덕산하이메탈이 5%대 오름세를 보였다. 가스 장치 전문... ",0.7,덕산하이메탈,0.2,Slightly Positive,Low,Short-term,Fact,반도체,Watch,"덕산하이메탈이 언급된 다른 반도체 관련주들의 상승세에 대한 보도, 제한적인 영향력."
077360,덕산하이메탈,"반도체 재료·부품관련주, '봄꽃만개' KEC·샘씨엔에스·덕산하이메탈·...",2026-02-24 18:10,http://www.finomy.com/news/articleView.html?idxno=250205,"24일 한국거래소에 따르면 KEC, 샘씨엔에스, 에스에이엠티, 덕산하이메탈, 하나마이크론, 레이크머티리얼즈, KX하이텍은 상승했다. KEC와 샘씨엔에스는 전 거래일 대비 각각 237원, 900원 오른 1028원과 1만2200원에 거래를... ",0.7,덕산하이메탈,0.3,Positive,Medium,Short-term,Fact,"반도체 재료, 반도체 부품",Watch,"반도체 재료/부품 관련주 상승 언급으로 단기적인 긍정적 영향 예상되나, 개별 종목의 특이적인 호재는 아님"
077360,덕산하이메탈,[이격도과열 종목] 나노엔텍·플라즈맵 상한가 직행…바이오·반도체 동...,2026-02-24 16:36,https://www.pinpointnews.co.kr/news/articleView.html?idxno=431888,"동부건설, 덕산하이메탈 등도 20일선 대비 크게 괴리됐다. 지수 상승에 베팅하는 레버리지 상품도 과열권에 포함됐다. TIGER 200IT레버리지, KODEX 반도체레버리지, 하나 레버리지 반도체 ETN, TIGER 200에너지화학레버리지... ",0.7,덕산하이메탈,0.0,Neutral,Low,Short-term,Fact,반도체,Watch,"단순 과열 언급으로, 덕산하이메탈에 대한 직접적인 투자 판단 근거는 부족함"
417840,저스템,"글로벌 자동차사도 러브콜... KEC, 전장용 반도체 비중 확대로 제2의 도...",2026-02-24 18:42,https://www.pinpointnews.co.kr/news/articleView.html?idxno=431925,반도체 오염 제어 솔루션 전문인 저스템은 22.96% 급등한 8300원에 마감했다. 식각 장비 전문 브이엠과 세정 장비 강자 피에스케이는 각각 10~19%대의 높은 수익률을 기록했다. 반도체 유통 전문 미래반도체와 리드프레임... ,0.7,저스템,0.3,Positive,Medium,Short-term,Fact,"반도체 오염 제어, 식각 장비, 세정 장비",Watch,반도체 관련주 전반적인 상승세 관찰 필요
187660,현대ADM,[상한가 종목] 한화비전-온코닉테라퓨틱스 이어 서울반도체-나노엔텍 등...,2026-02-24 21:30,http://www.econonews.co.kr/news/articleView.html?idxno=428661,"한화비전 주가흐름 (그래픽=네이버페이 증권 캡처) 24일 상한가 종목은 한화비전, KEC, 에이프로젠, 한국전자홀딩스, 온코닉테라퓨틱스, 현대ADM, 서울반도체, 나노엔텍, SKAI, 네오펙트, 해성옵틱스, 젠큐릭스... ",0.7,현대ADM,0.3,Positive,Low,Short-term,Fact,상한가,Watch,"상한가 종목 리스트에 포함되어 단기적인 관심이 필요하지만, 지속적인 상승 여부는 불확실함."
187660,현대ADM,"[주식] 온코닉테라퓨틱스, 美 FDA 희귀의약품 지정 30%↑",2026-02-24 19:46,https://www.hitnews.co.kr/news/articleView.html?idxno=74105,"오늘의 증시 시장 지수 KOSPI: 5,969.64 (▲2.11%) KOSDAQ: 1,165.00 (▲1.13%) 상승 종목 에이프로젠(+30.00%), 온코닉테라퓨틱스(+29.98%), 현대ADM(+29.93%), 나노엔텍(+30.00%), 한미사이언스(+18.60%) 하락 종목 셀비온(-21.37... ",0.7,현대ADM,0.7,Positive,Medium,Short-term,Fact,"KOSDAQ상승, 증시상승",Watch,"온코닉테라퓨틱스의 희귀의약품 지정 뉴스와 함께 현대ADM 주가도 급등하여 단기적인 관심이 필요하지만, 개별 호재는 아니므로 신중한 접근이 필요."
187660,현대ADM,"의료AI 관련주, '으쓱으쓱 어깨춤' 모아데이타·젠큐릭스·셀바스헬스케...",2026-02-24 18:16,http://www.finomy.com/news/articleView.html?idxno=250206,"현대경제신문 홍미경 기자 | 의료AI 관련주들이 전 거래일 대비 2.49% 상승으로 장을 마감했다. 24일... 셀루메드는 현재 동종골 이식재 '덴탈 파우더'와 골재생 의료기기 '라퓨젠(Rafugen) DBM', 동종피부(ADM) 이식재... ",0.7,현대ADM,0.1,Neutral,Low,Short-term,Fact,"의료AI, 동종피부이식재(ADM)",Watch,의료AI 테마 상승 및 ADM 이식재 관련 내용 언급으로 단기적 영향은 미미할 수 있으나 관심 유지가 필요함.
