ticker,name,title,pub_date,link,description,score,target_stock,sentiment_score,sentiment_label,impact_intensity,time_horizon,news_type,key_drivers,trading_signal,reason
090710,휴림로봇,"피지컬 AI·휴머노이드 로봇 관련주, '웃음꽃' 나인테크·유니테크노·M...",2026-02-24 18:20,http://www.finomy.com/news/articleView.html?idxno=250209,"LG전자(클로이드 홈로봇), 현대차·두산로보틱스, 삼성SDS·휴림로봇이 부품부터 플랫폼까지 풀스택 경쟁력을 강화 중이다. 피지컬 AI 시장은 2020년 50억달러에서 2030년 643억달러로 13배 확대, 2050년 휴머노이드 단독... ",0.7,휴림로봇,0.3,Positive,Medium,Long-term,Fact,"피지컬 AI, 휴머노이드 로봇",Watch,휴림로봇이 피지컬 AI 및 휴머노이드 로봇 시장 성장과 함께 장기적으로 긍정적인 영향을 받을 수 있음
090710,휴림로봇,"의료AI 관련주, '으쓱으쓱 어깨춤' 모아데이타·젠큐릭스·셀바스헬스케...",2026-02-24 18:16,http://www.finomy.com/news/articleView.html?idxno=250206,"소니드는 사물인터넷(IoT) 종합 솔루션과 자율주행로봇 시스템을 접목해 스마트물류 사업을 고도화하고, 휴림로봇의 산업용 로봇기술 노하우 및 시스템 솔루션과 접목시켜 차별화 전략을 추진하고 있다. 소니드는... ",0.7,휴림로봇,0.3,Positive,Medium,Mid-term,Fact,"자율주행로봇, 스마트물류, 산업용 로봇",Watch,"소니드와의 협력을 통한 스마트물류 사업 고도화 추진은 중장기적으로 긍정적이지만, 즉각적인 주가 상승을 기대하기는 어렵다."
090710,휴림로봇,"[오늘의 주목주] '소액주주 보호 명문화' 고려아연 8%대 상승, 코스닥 현...",2026-02-24 17:52,https://www.businesspost.co.kr/BP?command=article_view&num=431019,레인보우로보틱스(4.89%) 에스피지(2.71%) 유진로봇(3.64%) 휴림로봇(3.19%) 로보티즈(1.65%) 로보스타(1.05%)도 상승했다. 이날 코스닥 시가총액 상위 30개 종목 주가는 평균 1.13% 상승했다. 20개 종목 주가가 상승했고 9개... ,0.7,휴림로봇,0.3,약간 긍정적,Low,Short-term,Fact,로봇,Watch,로봇 관련주 전반적인 상승 흐름에 대한 소식으로 휴림로봇에 미치는 영향은 제한적.
45226K,한화갤러리아우,[상대강도과열 종목] SKAI·비츠로시스 '앗~뜨거' …단기 과열 신호 확산,2026-02-24 16:42,https://www.pinpointnews.co.kr/news/articleView.html?idxno=431889,"한진칼, KBI메탈, 제일파마홀딩스, 한화갤러리아, 와이솔, 누리플렉스, 파두, 텔코웨어, 빛샘전자 등이 RSI 80%를 상회했다. 건설·에너지·전기전자 업종에서는 SGC에너지, 태영건설, 매일홀딩스, 삼화콘덴서... ",0.7,한화갤러리아우,0.0,Neutral,Low,Short-term,Fact,,Watch,"상대 강도 과열 종목에 포함되었으나, 개별 종목에 대한 직접적인 언급이 없어 중립적인 관점에서 지켜볼 필요가 있음"
45226K,한화갤러리아우,"거래소, SGC에너지·다원넥스뷰 투자경고종목 지정",2026-02-23 08:04,https://www.pointdaily.co.kr/news/articleView.html?idxno=293782,"동아엘텍, 한화갤러리아우, 현대무벡스, 휴림로봇, 삼미금속, 아모센스, 유디엠텍, 인콘,     한스바이오메드, 삼표시멘트, 네오티스 등 32종목이다. 투자경고종목 제도는 주가가 5일간 60% 이상 오르는 등 단기 급등하는... ",0.7,한화갤러리아우,-0.3,Negative,Medium,Short-term,Fact,"Investment Warning, Volatility",Watch,투자 경고 종목 지정 가능성으로 단기적 변동성 확대 예상
45226K,한화갤러리아우,[상대강도과열 종목] 흥국화재 다원넥스뷰 퍼스텍 SK증권 '펄펄 끓네',2026-02-20 16:42,https://www.pinpointnews.co.kr/news/articleView.html?idxno=430944,"이어 다원넥스뷰, 퍼스텍, 한화손해보험, TBH글로벌, SK증권, 동양생명, 우리기술, 대성하이텍, SG&G, 한화갤러리아 등도 급등 대열에 합류했다. 전력·원전·에너지 관련주와 함께 한전산업, 애경산업, 큐라클... ",0.7,한화갤러리아우,0.0,Neutral,Low,Short-term,Rumor,,Watch,상대강도 과열 종목 언급으로 인한 일시적 주가 변동 가능성 존재
180400,DXVX,장남 손잡은 신동국… ‘한 방에 지배력 30%’ 권력지도 재편,2026-02-24 16:51,https://thetracker.co.kr/View.aspx?No=3982958,코리는 또 임 회장이 최대주주인 DXVX 지분 7.4%도 보유 중이다. 임종윤(54) 코리그룹 회장은 한미약품 사장... 개인기업 DXVX가 보유 중이던 한미사이언스 지분 4.13%를 1300억원에 장외매도해 주목을 끈 바 있다. 이때 이... ,0.7,DXVX,0.0,Neutral,Medium,Short-term,Disclosure,"경영권 승계, 지분 변동",Watch,경영권 승계 관련 지분 변동으로 단기적인 주가 변동 가능성이 있으나 중립적 영향으로 판단됨.
180400,DXVX,"릴리도 반한 'GalNAc' 기술…올릭스, 비만치료제 임상 2상 순항",2026-02-24 13:02,https://www.pinpointnews.co.kr/news/articleView.html?idxno=431756,"대화제약과 DXVX, 라파스가 소폭 하락 중이며 삼천당제약은 0.81% 하락한 61만 1000원을 기록하고 있다. 펩트론, 신신제약, 한미약품, 제넥신, HK이노엔도 조정세를 보인다. 고바이오랩과 HLB펩, 케어젠이 하락 중이며... ",0.7,DXVX,-0.2,Slightly Negative,Low,Short-term,Fact,"Pharmaceutical, Clinical Trial",Watch,"DXVX 주가가 소폭 하락하고 있으며, 전반적인 제약/바이오 섹터의 조정세가 나타나고 있음. 비만치료제 임상 2상 순항은 긍정적이지만, 현재 주가에는 미미한 영향을 주는 것으로 보임."
180400,DXVX,대웅제약의 야망 '1품 1조'… K-신약으로 글로벌 심장 뚫는다,2026-02-23 14:42,https://www.pinpointnews.co.kr/news/articleView.html?idxno=431405,"의약품 유통 플랫폼 블루엠텍과 대형 화학사 LG화학, 정밀 의학 전문 DXVX가 내림세를 보이고 있으며, HLB펩과 HLB제약, 종근당도 소폭 하락세를 나타낸다. 최근 급등했던 삼천당제약은 차익 실현 매물이 쏟아지며 4.8% 넘게... ",0.7,DXVX,-0.2,Negative,Low,Short-term,Fact,"의약품 유통, 내림세",Watch,DXVX 주가가 하락세를 보이고 있어 단기적으로 관망이 필요함
003160,디아이,"글로벌 자동차사도 러브콜... KEC, 전장용 반도체 비중 확대로 제2의 도...",2026-02-24 18:42,https://www.pinpointnews.co.kr/news/articleView.html?idxno=431925,"세정 및 코팅 전문 코미코와 클린룸 설비의 한양이엔지, 핸들러 전문 테크윙, 소재 강자 이엔에프테크놀로지, 마이크로컨트롤러 전문 어보브반도체, 검사 장비의 디아이도 상승 마감했다. 로봇 암 전문 라온로보틱스와... ",0.7,디아이,0.0,Neutral,Low,Short-term,Fact,반도체 검사장비,Watch,기사에서 디아이가 상승 마감했다는 정보 외에 구체적인 투자 판단을 내릴 근거가 부족함
003160,디아이,"블랙올 AI, ‘디지털 영생 AI’·기업용 데이터 온톨로지 AI ‘디아이’...",2026-02-24 16:45,https://n.news.naver.com/mnews/article/117/0004038216?sid=105,AI ‘디아이(The Eye)’와 시니어 종합의료 플랫폼 ‘닥터이모(Dr.Imo)’에 적용되는 세계 최초 ‘디지털 영생 AI’ 기술을 동시에 공개하며 AI 사업 포트폴리오를 확대한다. ‘디아이’는 기업의 업무·재무 데이터와... ,0.7,디아이,0.3,약간 긍정적,Medium,Short-term,Expectation,"AI, 데이터 온톨로지, 디지털 영생",Watch,"AI 기술 적용 확대로 인한 기대감이 있지만, 구체적인 실적 영향은 불확실함"
003160,디아이,[데이터 뉴스룸] 유통업체 50곳 재고자산 증가했는데 매출은 감소…재고...,2026-02-24 13:45,https://www.greened.kr/news/articleView.html?idxno=337242,롯데쇼핑과 이마트를 제외하고 ▲GS리테일(755억 원) ▲CJ프레시웨이(528억 원) ▲디아이동일(419억 원)... 최근 1년 새 재고자산 증가율로 보면 롯데쇼핑 다음으로 '디아이동일'이 높은 것으로 파악됐다. 이 회사의... ,0.7,디아이,-0.3,약간 부정적,Medium,Short-term,Fact,"재고, 유통",Watch,디아이의 재고 자산 증가율이 높아 단기적으로 주가에 부정적인 영향을 줄 수 있음
101490,에스앤에스텍,'몸값-체력' 괴리…매출·이익 증가율은 10% 안팎,2026-02-23 17:59,https://n.news.naver.com/mnews/article/015/0005254080?sid=101,한미반도체는 차세대 패키징 장비 공장을 지을 계획이다. 극자외선(EUV) 노광 공정 핵심 부품인 블랭크마스크 분야 세계 3대 업체인 에스앤에스텍은 지난해 1000억원을 투자해 EUV 전용 생산라인을 구축했다.,0.9,에스앤에스텍,0.2,Slightly Positive,Medium,Mid-term,Fact,"EUV, 블랭크마스크",Watch,"EUV 블랭크마스크 생산라인 구축 투자는 긍정적이나, 매출 및 이익 증가율이 낮은 점을 고려하여 관망 필요."
101490,에스앤에스텍,‘금융·원전·반도체’ K증시 이끈다…신고가 속출 랠리 [매경 자이앤...,2026-02-20 17:38,https://n.news.naver.com/mnews/article/009/0005639572?sid=101,"삼성전기 역시 4423억원의 거래대금을 기록하며 역사적 고점을 새로 썼고, 두산, 에스앤에스텍, 씨엠티엑스 등 관련 종목들도 신고가 대열에 합류했다. 전력설비와 조선·에너지 관련 종목들도 시장의 주목을 받았다.... ",0.9,에스앤에스텍,0.6,Positive,Medium,Short-term,Fact,반도체,Watch,"신고가 경신 소식은 긍정적이지만, 시장 전반의 랠리 분위기와 함께 봐야 함"
101490,에스앤에스텍,"글로벌 자동차사도 러브콜... KEC, 전장용 반도체 비중 확대로 제2의 도...",2026-02-24 18:42,https://www.pinpointnews.co.kr/news/articleView.html?idxno=431925,"그 외에도 시지트로닉스, 동진쎄미켐, 월덱스, 원익IPS, 와이씨, 아이에스티이, ISC, 에스티아이, 티이엠씨씨엔에스, 뉴파워프라즈마, 아이텍, 사피엔반도체, 에스앤에스텍, 지오엘리먼트, 제이티, 위드텍, 제이아이테크... ",0.7,에스앤에스텍,0.0,Neutral,Low,Short-term,Rumor,반도체,Watch,"기사 내용에 에스앤에스텍이 언급되었으나, 직접적인 연관성이 낮아 중립적인 관점에서 지켜볼 필요가 있음"
005440,현대지에프홀딩스,[오늘의 코스피 · 2월 24일] 금일 상승주 TOP 10…1위 에이프로젠,2026-02-24 21:16,http://www.newsbrite.net/news/articleView.html?idxno=196582,"현대지에프홀딩스(005440)는 +20.19% 상승하여 18,750원이다. ▲상위 종목 지표(출처: 한국거래소) ©뉴스브라이트 순위 종목명 현재가 전일비 등락률 거래량 PER ROE ▲상위 종목 지표(출처: 한국거래소)... ",0.7,현대지에프홀딩스,0.6,Positive,Medium,Short-term,Fact,상승,Watch,"현대지에프홀딩스가 금일 코스피에서 높은 상승률을 기록하여 단기적으로 긍정적인 영향을 줄 수 있지만, 추이를 지켜볼 필요가 있음."
005440,현대지에프홀딩스,돌아온 주총 시즌…유통업계 주주친화 행보 '눈길',2026-02-24 17:44,https://news.mtn.co.kr/news-detail/2026022416402977564,"지주사인 현대 지에프홀딩스와 현대백화점, 현대그린푸드는 추가로 자사주를 취득한 뒤 연내 소각하기로 했습니다.계획발표 당시 종기 기준으로 자사주 소각 규모는 총 3500억원에 달합니다.롯데쇼핑은 배당을... ",0.7,현대지에프홀딩스,0.6,Positive,Medium,Mid-term,Disclosure,"Shareholder Value, Share Buyback",Watch,"자사주 소각 결정은 주주 가치 제고에 긍정적이지만, 즉각적인 주가 상승보다는 중장기적인 관점에서 지켜볼 필요가 있음."
005440,현대지에프홀딩스,"월마트 1조 달러 돌파했는데…韓 유통 빅3, 저평가 탈출 시동",2026-02-24 17:08,https://n.news.naver.com/mnews/article/092/0002411661?sid=105,또 현대지에프홀딩스(1000억원)·현대백화점(210억원)·현대그린푸드(100억원)·현대퓨처넷(47억원)은 자사주를 추가 취득해 연내에 소각할 방침이다. 계획대로 실행되면 현대백화점그룹의 자사주 소각 규모는 모두 약... ,0.7,현대지에프홀딩스,0.3,Positive,Medium,Short-term,Disclosure,자사주 소각,Watch,"자사주 소각 계획 발표는 주가에 긍정적 영향을 줄 수 있으나, 규모를 고려했을 때 단기적인 영향에 그칠 수 있음"
010690,화신,[명동백작들의 영화 이야기㉑] 다큐멘터리 <경성> 속 모던 보이 박인환...,2026-02-24 16:32,https://www.news2day.co.kr/article/20260224500196,이 영화들은 모두 문화영화 전문극장에서 상영됐는데 舊화신백화점 내에 있었던 화신영화관과 미나카이(三中井) 백화점(현 밀리오레 명동 자리) 뒤편의 경일문화영화극장에서 볼 수 있던 것이었다. 경일문화영화극장은... ,0.7,화신,0.0,Neutral,Low,Ignore,Fact,,Ignore,화신백화점 관련 과거 정보를 다루고 있어 현재 주가에 미치는 영향은 미미하다고 판단됨
010690,화신,[정승열의 힐링여행2] 293. 이집트 신화,2026-02-24 16:20,https://www.ggilbo.com/news/articleView.html?idxno=1143243,"파라오들은 자신을 오시리스(Osyris)와 이시스(Isis) 여신이 낳은 아들 호루스(Horus)의 화신이라고 했지만, 제4왕조의 세 번째 카프레 왕은 자신이 태양신의 화신이 아니라 프타 신과 동등하다며, 신과 동격인 삼신상... ",0.7,화신,0.0,Neutral,Low,Ignore,Rumor,N/A,Ignore,이집트 신화 관련 기사로 주가에 미치는 영향은 미미하다고 판단됨
010690,화신,"세아메카닉스, 알루미늄 다이캐스팅의 힘…전기차 넘어 ESS로 질주",2026-02-24 15:30,https://www.pinpointnews.co.kr/news/articleView.html?idxno=431818,"내장재 전문 이닉스와 고전압 릴레이 전문 와이엠텍, 멤브레인 제조사 상아프론테크, 조향 부품사 화신, 구동 시스템의 우수AMS, 파운드리 서비스의 엣지파운드리도 소폭 상승 중이다. 현대차와 램프 전문... ",0.7,화신,0.0,Neutral,Low,Short-term,Fact,"전기차, 알루미늄 다이캐스팅",Watch,기사에서 화신의 소폭 상승 언급 외 뚜렷한 투자 방향성을 제시하지 않음
036580,팜스코,"""발효공학이 살린 수익성""...이지바이오, 고부가가치 배합사료로 승부수",2026-02-23 11:06,https://www.pinpointnews.co.kr/news/articleView.html?idxno=431333,"육계 가공 전문 동우팜투테이블과 자동차 부품사임에도 방역차량 이슈로 엮인 체시스, 축산 전문 팜스코도 상승 대열에 합류했다. 인체 및 동물의약품 전문 대한뉴팜과 동물의약품 노하우를 가진 이글벳, 수산물 유통... ",0.7,팜스코,0.2,Slightly Positive,Low,Short-term,Fact,"배합사료, 축산",Watch,"기사 내용이 팜스코에 대한 직접적인 내용이 아니고, 상승 대열에 합류했다는 피상적인 언급만 있어 단기적으로 중립적인 영향 예상."
036580,팜스코,"사료부터 고기까지 한입에... 팜스토리, 축산 수직계열화로 '잭팟'",2026-02-23 10:28,https://www.pinpointnews.co.kr/news/articleView.html?idxno=431306,"설탕과 사료 사업을 병행하는 대한제당과 축산 전문 기업 팜스코 역시 견조한 흐름을 유지하고 있다. 기능성 사료 소재를 공급하는 미래생명자원과 동물의약품 전문 우진비앤지, 그리고 돼지고기 및 사료 브랜드로 알려진... ",0.7,팜스코,0.6,약간 긍정적,Medium,Mid-term,Fact,"사료, 축산, 수직계열화",Watch,"팜스코의 축산 수직계열화 전략이 중장기적으로 긍정적인 영향을 줄 수 있으나, 추가적인 정보 확인이 필요함."
036580,팜스코,"[데이터 뉴스룸] 식품업체 50곳, 재고자산 늘 때 매출도 동반 상승…재...",2026-02-22 23:25,https://www.greened.kr/news/articleView.html?idxno=337153,여기에는 ▲CJ제일제당(310억 원↓) ▲선진(232억 원↓) ▲팜스코(158억 원↓) ▲고려산업(150억 원... 이중 사조대림과 사조오양를 제외한 ▲CJ제일제당 ▲선진 ▲팜스코 ▲고려산업 ▲남양유업은 재고자산이... ,0.7,팜스코,0.0,Neutral,Low,Short-term,Fact,"재고자산, 매출",Watch,팜스코의 재고자산 감소가 매출과 동반하여 발생했으므로 중립적인 신호로 판단됨
298020,효성티앤씨,폐페트병이 티셔츠로 변신한다,2026-02-24 20:58,https://www.ulsanpress.net/news/articleView.html?idxno=569757,효성티앤씨가 카카오뱅크와 손잡고 친환경 기부 마라톤 '세이브 레이스(Save Race) 2026'의 공식 파트너로 참여한다. 효성티앤씨는 24일 카카오뱅크 판교오피스에서 '세이브 레이스 2026'의 친환경 요소 강화를 위한 상호... ,0.7,효성티앤씨,0.3,Positive,Low,Long-term,Fact,"친환경, ESG, 카카오뱅크",Watch,"친환경 마라톤 협찬은 장기적으로 기업 이미지에 긍정적이나, 단기적인 주가 영향은 미미할 수 있음"
298020,효성티앤씨,"효성티앤씨, '세이브 레이스 2026'공식 파트너 참여 ... 리젠 굿즈 제작",2026-02-24 20:52,http://www.worktoday.co.kr/news/articleView.html?idxno=81640,"효성티앤씨와 카카오뱅크가 24일 '세이브레이스 2026' 공식 파트너 MOU를 체결했다. (왼쪽부터) 이형주 카카오뱅크 AI그룹장, 유소라 효성티앤씨 ESG 경영담당 상무 효성티앤씨가 카카오뱅크와 손잡고 친환경 기부 마라톤... ",0.7,효성티앤씨,0.3,Positive,Low,Short-term,Fact,"ESG, 친환경",Watch,"친환경 마라톤 파트너 참여는 단기적으로 긍정적이나, 주가에 미치는 영향은 미미할 수 있음"
298020,효성티앤씨,[브리프] 현대차 두산 한솔 효성티엔씨 삼표 KCC 태림포장 KG그룹 外,2026-02-24 20:00,http://www.biztribune.co.kr/news/articleView.html?idxno=349356,"■ 효성티엔씨, '세이브 레이스 2026' 공식 파트너로 자원 선순환 구현 효성티앤씨와 카카오뱅크가 24일 오전 카카오뱅크 판교오피스에서 '세이브레이스 2026' 공식 파트너 MOU를 체결했다. (왼쪽부터) 이형주 카카오뱅크... ",0.7,효성티앤씨,0.3,약간 긍정,Low,Long-term,Fact,"자원 선순환, ESG",Watch,자원 선순환 파트너십 체결은 긍정적이나 단기적 주가 영향은 미미할 것으로 예상됨
049800,우진플라임,[민선 9기 인천시장의 숙제] '정무적 리더십'이 규제 역차별 해소 열쇠,2026-02-23 19:40,https://www.joongboo.com/news/articleView.html?idxno=363717900,"유영석 인천상공회의소 경제진흥실장은 과거 우진플라임의 충북 이전 사례를 언급하며 ""인천이 수도권 프레임에 갇혀 유망 기업을 놓치지 않으려면, 차기 시장은 강화·옹진 등 접경지역과 경제자유구역에 대한 규제... ",0.7,우진플라임,-0.3,Negative,Medium,Long-term,Fact,"규제, 수도권 규제, 기업 이전",Watch,인천시의 규제가 우진플라임의 사업 환경에 부정적인 영향을 미칠 수 있다는 우려가 존재.
049800,우진플라임,"(주)우진플라임, 현대자동차(주)와 ‘클린폼’ 기술 검증",2026-02-23 17:30,http://robotzine.co.kr/entry/277241,이에 우진플라임(주)은 ‘클린폼(Clean-Foam)’을 통해 이러한 한계를 극복하고 있다. 본지는 우진플라임(주)이 현대자동차(주)와의 기술 검증 사례를 통해 해당 공법의 기술적 의미와 산업적 확장성을 살펴본다.... ,0.7,우진플라임,0.3,Positive,Medium,Mid-term,Fact,"클린폼, 현대자동차, 기술 검증",Watch,"현대자동차와의 클린폼 기술 검증은 긍정적이지만, 산업적 확장성은 좀 더 지켜봐야 함."
049800,우진플라임,"기계 상장기업 브랜드평판 2월 빅데이터 분석... 1위 두산에너빌리티, ...",2026-02-23 07:20,https://www.pinpointnews.co.kr/news/articleView.html?idxno=431187,"코메론, 케이피에프, 동일금속 , 부스타, 화천기공, 씨에스베어링, 이엔플러스, 넥스턴앤롤코리아, 디와이피엔에프, 신진에스엠, 프리엠스, 아세아텍, 우진플라임, 에쎈테크, 아스플로, 티에스넥스젠 이다.",0.7,우진플라임,0.0,Neutral,Low,Short-term,Fact,Brand Reputation,Watch,"브랜드 평판 분석 결과에 따른 단순 언급으로, 주가에 미치는 영향은 미미하다고 판단됨."
123750,알톤,800회 충전에도 '안심' 전기자전거,2026-02-23 16:06,https://n.news.naver.com/mnews/article/009/0005640587?sid=101,"알톤, LMFP 배터리 자전거 자전거 전문기업 알톤이 국내 자전거업계 최초로 리튬망간인산철(LMFP) 배터리를 적용한 전기자전거를 상용화하며 차세대 전기자전거 시장 공략에 속도를 낸다. 알톤은 열 안정성과 수명... ",0.9,알톤,0.6,Positive,Medium,Mid-term,Fact,"LMFP 배터리, 전기자전거",Watch,"알톤이 LMFP 배터리 적용 전기자전거 상용화로 긍정적 영향을 받을 수 있으나, 시장 반응을 지켜볼 필요가 있음"
123750,알톤,"잡초에 주목한 괴짜 식물학자 ""칭찬만으론 배가 고픕니다""[인물로 본 세...",2026-02-21 10:04,https://n.news.naver.com/mnews/article/002/0002428683?sid=104,"실패를 딛고 실리를 챙긴 윌리엄 커티스의 위대한 유산 마구간지기에게 배운 식물학, 주류학계에 던진 출사표 1746년 1월 11일, 영국 햄프셔의 작은 마을 알톤에서 태어난 윌리엄 커티스(William Curtis, 1746-1799)의 출발은... ",0.7,알톤,0.0,Neutral,Low,Ignore,Fact,,Ignore,기사 내용이 알톤 종목 자체와 직접적인 관련이 없어 투자 판단에 영향을 미치지 않습니다.
123750,알톤,‘실적 씽씽’ 삼천리·알톤…전기자전거 앞세워 수익성 개선,2026-02-19 05:00,https://www.etoday.co.kr/news/view/2557115,"이투데이=서이원 기자 | 삼천리자전거, 견조한 성장세…신제품 런칭 확대도 알톤, 영업익 흑자 전환…전기자전거 비중 70% 목표 국내 자전거업계 대표 주자인 삼천리자전거와 알톤이 지난해 호실적을 달성했다. 두 회사... ",0.7,알톤,0.6,Positive,Medium,Mid-term,Earnings,"전기자전거, 실적 개선",Watch,"알톤의 영업이익 흑자 전환 및 전기자전거 비중 확대 목표는 중기적으로 긍정적 영향을 줄 수 있으나, 시장 상황을 지켜볼 필요가 있음"
035810,이지홀딩스,"[특징주 & 리포트] '미래에셋생명, 2거래일째 상한가' 등",2026-02-23 17:04,https://n.news.naver.com/mnews/article/015/0005253989?sid=101,● ‘깜짝 배당’ 이지홀딩스 급등 이지홀딩스는 가격제한폭(29.97%)까지 오른 7720원에 거래를 마쳤다. 지난 20일 장 마감 후 시가 대비 20%를 웃도는 대규모 일회성 배당을 공시한 영향으로 이날 개장 직후 상한가로... ,0.9,이지홀딩스,0.7,Positive,High,Short-term,Disclosure,배당,Watch,대규모 배당 공시로 인한 단기적인 주가 급등 가능성
035810,이지홀딩스,'벚꽃 배당'의 계절…배당수익률 높고 소득세 인하 예상 종목은?,2026-02-24 16:57,https://n.news.naver.com/mnews/article/008/0005321651?sid=101,"지난해 연말 주가 기준 배당수익률이 가장 높은 기업은 이지홀딩스로, 배당수익률이 30.41%에 달한다. 배당 기준일은 오는 3월10일이고, 주당 배당금은 1361원이다. 오는 3월6일 장마감까지 이지홀딩스를 보유하면... ",0.85,이지홀딩스,0.7,Positive,Medium,Short-term,Fact,"배당수익률, 배당금",Watch,"높은 배당수익률은 긍정적이지만, 단기적 영향에 그칠 수 있으므로 신중한 접근이 필요함"
035810,이지홀딩스,[상대강도과열 종목] SKAI·비츠로시스 '앗~뜨거' …단기 과열 신호 확산,2026-02-24 16:42,https://www.pinpointnews.co.kr/news/articleView.html?idxno=431889,"제일약품, 엑스플러스, HL D&I, 케이비아이동국실업, HLB파나진, 애경산업, 현대홈쇼핑, 이지홀딩스, 부광약품 등이 포함됐다. 지주·유통·IT 장비주도 강세 대열에 합류했다. 한진칼, KBI메탈, 제일파마홀딩스... ",0.7,이지홀딩스,0.0,Neutral,Low,Short-term,Fact,,Watch,"단기 과열 신호 확산에 따른 언급으로, 이지홀딩스 자체의 호재/악재 정보는 아님"
244920,에이플러스에셋,"[52주] 최고가 73개, 최저가 26개...지수 혼조세",2026-02-24 09:58,https://www.itooza.com/common/iview.php?no=2026022409340107853,"2% 5,610 ★★★★★ 30 에이플러스에셋 14,770 ▲5.1% 14,770 ★★★★ 31 현대바이오 18,630 ▲4.8% 19,230 ★★ 32 LS머트리얼즈 17,560 ▲4.7% 18,030 ★★★ 33 하이텍팜 17,670 ▲4.4% 17,800... ",0.7,에이플러스에셋,0.2,약간 긍정,Low,Short-term,Fact,,Watch,"에이플러스에셋 주가가 소폭 상승했지만, 시장 혼조세 속에서 52주 최고가에 근접하여 신중한 접근이 필요함."
